Question Report,
Report Generated:,"Jan 07, 2022 1:50 PM"
Topic,Webinar ID,Actual Start Time,Actual Duration (minutes),# Question
Tobacco Online Policy Seminar (TOPS),913 0423 0768,"Jan 07, 2022 11:45 AM", 78, 20
Question Details,
#,Question,Asker Name,Asker Email,Answer(s),Question Time,Answered Time,
1,Can he please slow down.  It's hard to follow him,Debora Rippel,debora.rippel@suffolkcountyny.gov,,01/07/2022 12:13:04
2,"How do qualitytive aspects are reflected in the model, e.g. where regulations massively favor e.g. Big Players and are almost impossible to meet by small or medium sized businesses?",Norbert Zillatron Schmidt,norbert.schmidt@posteo.de,live answered,01/07/2022 12:13:14,01/07/2022 12:35:35
3,How do you characterize regulatory stance at different governmental levels if those are more or less permissive than one another?,Shyanika Rose,shyanika@yahoo.com,live answered,01/07/2022 12:15:11,01/07/2022 12:36:16
4,Could the tobacco industry alter these codes to misrepresent sales data?,Anamaria Penagos,Anamaria.Penagos@flhealth.gov,live answered,01/07/2022 12:21:05,01/07/2022 12:35:37
5,"EVALI: Has the (far too) late ""revelation"" of the true cause (Vit. E-Acetate, NOT nicotine vaping, NOT flavors) of EVALI have any influence on restrictive regluations that used EVALI as a pretext for justification?",Norbert Zillatron Schmidt,norbert.schmidt@posteo.de,,01/07/2022 12:21:10
6,How strong is bas are the sales data when the nielssen rating only encompas the sales vanues that are used mainly by big tobacco companies and their direct competition (disposable / non-refillable pods) while most open systems are mostly sold via untracked venues like specialist shops and online?,Norbert Zillatron Schmidt,norbert.schmidt@posteo.de,live answered,01/07/2022 12:30:46,01/07/2022 12:40:10
7,"If a regulator adopts safety rules for new products, presumably that would tend to reduce sales in the short term (because some brands would disappear) but might increase sales in the long term (because potential consumers would be reassured on safety). How do you count such things in your framework?",Francis Thompson,fthompson@healthbridge.ca,,01/07/2022 12:33:16
8,What % of the total e-cig mkt is accounted for by vape shops relative to gas & convenience stores? In Canada G & C stores have 30% I wonder if there is any reason that sales in vape shops might have been impacted differently by EVALI?,Ian Irvine,ian.irvine@concordia.ca,live answered,01/07/2022 12:35:23,01/07/2022 12:40:00
9,"Where are open systems in your ""Example Application""?
I can only see ""Pod-Mod"" and ""disposable"".
Ignored because of seeming insignificance in the Nielssen numbers?",Norbert Zillatron Schmidt,norbert.schmidt@posteo.de,,01/07/2022 12:37:03
10,Would be interesting to add in non-cigarette tobacco product sales in this mix.,Amanda Holm,aholm1@hfhs.org,,01/07/2022 12:38:52
11,"Does menthol cig use in Poland vary systematically with demographics, e.g. men/women, rural/urban, or maybe some ethnicity? I ask because in the US the menthol market share is so much larger for African-American smokers.",Don Kenkel,dsk10@cornell.edu,live answered,01/07/2022 12:45:33,01/07/2022 12:58:35
12,What would the effect of the menthol ban been had prices not dropped?,Lauren Lempert,lauren.lempert@ucsf.edu,live answered,01/07/2022 12:50:55,01/07/2022 13:00:13
13,"Building on Don's question, are menthol cigarettes used more or less frequently among young people in Poland? Does Poland survey their youth for tobacco use? Is there a way to see if youth initiation has declined?",Emma Peterson,epeterson@wchd.org,"Building on Don's question, are menthol cigarettes used more or less frequently among young people in Poland? Does Poland survey their youth for tobacco use? Is there a way to see if youth initiation has declined?",01/07/2022 12:51:20,01/07/2022 12:51:20,live answered,01/07/2022 12:51:20,01/07/2022 12:58:38
14,how do we access this data?,Laura McCulloch,lmcculloch@ldchealth.org,You’d need to purchase directly from Nielsen,01/07/2022 12:52:12,01/07/2022 12:53:13
15,"Alex, Great talk but how much was the menthol ban anticipated to have a short term effect? Is the anticipated effect not longer term, specifically on youth uptake and that would take much longer to show.",Martin Dockrell,martin.dockrell@dhsc.gov.uk,live answered,01/07/2022 12:52:16,01/07/2022 13:00:11
16,Great presentation Alex!  Do you think that one of the challenges with sales data is that they may mask differences across subgroups in the effects of the policies?  And are there ways to get around this?,Joanna Cohen,jcohen@jhu.edu,live answered,01/07/2022 12:55:03,01/07/2022 12:58:46
17,"I agree that sales data are great! But for the record, I've presented sales data results about EVALI in November 2020 (more than a year ago) at the Southern Economic Association meetings, and also at last summer's ASHEcon meeting.",Don Kenkel,dsk10@cornell.edu,,01/07/2022 12:55:16
18,"To get the full picture, is there any way to estimate the sales via the black market?",Norbert Zillatron Schmidt,norbert.schmidt@posteo.de,,01/07/2022 12:55:22
19,is there a website or contact to get in touch with to learn more?,Laura McCulloch,lmcculloch@ldchealth.org,I’d suggest contacting Alex by email. I know he’s advised others.,01/07/2022 12:56:37,01/07/2022 12:57:31
20,"It was clear in the UK that all three major manufacturers had post-ban brand variants to fill the gap left by menthol cigarettes, flavoured inserts was only one strategy. Are you aware of other post-ban menthol replacement products in Poland?",Martin Dockrell,martin.dockrell@dhsc.gov.uk,,01/07/2022 12:59:38
